{
  "project": "llmops-local",
  "config_version": "train-smoke-tiny-gpt2-v1",
  "run_id": "train-smoke-tiny-gpt2-001",
  "training_backend": "continued_pretraining",
  "base_model_id": "sshleifer/tiny-gpt2",
  "tokenizer_name": "sshleifer/tiny-gpt2",
  "epochs": 1,
  "batch_size": 1,
  "learning_rate": 0.00005,
  "block_size": 64,
  "gradient_accumulation_steps": 1,
  "weight_decay": 0.01,
  "warmup_ratio": 0.0,
  "max_grad_norm": 1.0,
  "seed": 42
}
